{
  "contract_version": "capability-registry/v1",
  "baseline": {"release": "v0.1.0", "commit": "3d53a2404e74d76c160aaeb92ace1e8a3e6bd999", "parent_issue": 28},
  "sources": [
    {"id": "observed.standard", "kind": "sanitized-observation", "summary": "Independent summary of the sanitized reference report, sections 3.2-3.4: twenty visible standard domains and Ask interaction modes.", "limitations": "Visibility establishes product scope, not backend implementation, deployed permissions, durability, or compatibility. Source material is not distributed."},
    {"id": "observed.operators", "kind": "sanitized-observation", "summary": "The sanitized reference report enumerates twenty-six operator family names.", "limitations": "Inventory only. Exact semantics, algorithms, connector coverage, and authorization behavior are unknown; our conformance cases are independent requirements."},
    {"id": "requirements.commercial", "kind": "product-requirement", "summary": "Parent issue #28 and implementation issues #29-#38 define commercial and integration acceptance.", "limitations": "Requirements are not observations or implementation evidence; no certification, billing activation, or release deadline is implied."},
    {"id": "repository.m0", "kind": "repository", "summary": "M0 is a local synthetic two-scenario baseline, with typed v0 contracts and process-local state.", "limitations": "Existing M0 subsets do not establish full standard capabilities. See README.md and the immutable baseline commit."}
  ],
  "evidence": [
    {"id": "registry.code", "kind": "implementation", "ref": "contracts/product/validation.py", "scope": "Offline registry coverage, reference, evidence and DAG checks; not a runtime feature switch."},
    {"id": "registry.test", "kind": "test", "ref": "tests/test_product_contracts.py::test_capability_registry", "scope": "Checked-in registry satisfies the executable scope contract."},
    {"id": "context.code", "kind": "implementation", "ref": "contracts/product/v1/trusted-context.schema.json", "scope": "Trusted-context shape only, not OIDC verification or access enforcement."},
    {"id": "resource.code", "kind": "implementation", "ref": "contracts/product/v1/resource-version.schema.json", "scope": "Resource identity shape only, not persistence or publication."},
    {"id": "audit.code", "kind": "implementation", "ref": "contracts/product/v1/audit-envelope.schema.json", "scope": "Append-only envelope and offline sequence checks, not an audit store."},
    {"id": "usage.code", "kind": "implementation", "ref": "contracts/product/v1/usage-envelope.schema.json", "scope": "Usage and correction envelopes only, not collection, quotas or charging."},
    {"id": "schemas.test", "kind": "test", "ref": "tests/test_product_contracts.py::test_positive_examples", "scope": "Synthetic positive fixtures validate against local Draft 2020-12 schemas with format checking."},
    {"id": "schemas.negative", "kind": "test", "ref": "tests/test_product_contracts.py::test_negative_examples", "scope": "Synthetic invalid examples are rejected. No claim about deployed security."}
  ],
  "capabilities": [
    {
      "id": "standard.ask", "description": "Governed analysis workspace with progress, results and lineage across all Ask modes.", "category": "standard-domain",
      "observed_source": {"ref": "observed.standard", "confidence": "high"}, "state": "planned", "current_gap": "M0 supports two synthetic single-question scenarios, not generalized analysis or all interaction modes.",
      "dependencies": ["ask.single", "ask.chat", "ask.ontology-assistant", "ask.clarification"], "owner_surface": "web", "issue": 36, "milestone": "M2",
      "acceptance": {"positive": {"scenario": "Complete an authorized question and navigate progress, typed results and lineage.", "test_ref": null}, "negative": {"scenario": "Unsupported or unauthorized questions cannot trigger execution.", "test_ref": null}, "integration": {"scenario": "UI to authorized compiler/runtime to committed results across reconnect.", "test_ref": null}}, "evidence": []
    },
    {
      "id": "standard.runs", "description": "Searchable run history, details, cancellation, pinning and retention-aware deletion.", "category": "standard-domain",
      "observed_source": {"ref": "observed.standard", "confidence": "high"}, "state": "planned", "current_gap": "M0 history and cancellation are process-local; full lifecycle and durable pinning are missing.",
      "dependencies": ["foundation.durable-runtime", "foundation.identity-workspace"], "owner_surface": "web", "issue": 36, "milestone": "M2",
      "acceptance": {"positive": {"scenario": "Find, pin and cancel owned runs, retaining final diagnostics after restart.", "test_ref": null}, "negative": {"scenario": "Cross-workspace IDs cannot reveal, pin or cancel another run.", "test_ref": null}, "integration": {"scenario": "History UI, control store and worker agree after cancellation and restart.", "test_ref": null}}, "evidence": []
    },
    {
      "id": "standard.statistics", "description": "Scoped run, stage and outcome aggregates with defined counting rules.", "category": "standard-domain",
      "observed_source": {"ref": "observed.standard", "confidence": "high"}, "state": "planned", "current_gap": "No complete durable standard statistics surface.",
      "dependencies": ["foundation.durable-runtime", "foundation.identity-workspace"], "owner_surface": "control-api", "issue": 36, "milestone": "M2",
      "acceptance": {"positive": {"scenario": "Aggregate known synthetic runs by stage and outcome with explicit filters.", "test_ref": null}, "negative": {"scenario": "Retries and foreign workspaces do not inflate or leak counts.", "test_ref": null}, "integration": {"scenario": "Console aggregates reconcile with persisted runs across restart.", "test_ref": null}}, "evidence": []
    },
    {
      "id": "standard.my-data", "description": "Personal scoped data catalog, upload preflight, folders and reference-aware removal.", "category": "standard-domain",
      "observed_source": {"ref": "observed.standard", "confidence": "high"}, "state": "planned", "current_gap": "Checked-in synthetic data is not an end-user upload/catalog workflow.",
      "dependencies": ["foundation.identity-workspace", "commercial.secret-references"], "owner_surface": "semantic-backend", "issue": 36, "milestone": "M2",
      "acceptance": {"positive": {"scenario": "Upload bounded synthetic data, catalog it and detect dependent references.", "test_ref": null}, "negative": {"scenario": "Reject oversized files, path traversal and removal of referenced objects.", "test_ref": null}, "integration": {"scenario": "Upload UI, scoped metadata and object store reconcile partial failures.", "test_ref": null}}, "evidence": []
    },
    {
      "id": "standard.ontologies", "description": "Author entities, fields, metrics, relations, bindings and policies; import, publish and roll back versions.", "category": "standard-domain",
      "observed_source": {"ref": "observed.standard", "confidence": "high"}, "state": "planned", "current_gap": "v0 schemas and synthetic ontology exist; durable governed authoring/publishing do not.",
      "dependencies": ["foundation.resource-version", "foundation.identity-workspace", "foundation.control-persistence"], "owner_surface": "control-api", "issue": 35, "milestone": "M2",
      "acceptance": {"positive": {"scenario": "Publish a validated draft and roll back by publishing a new immutable revision.", "test_ref": null}, "negative": {"scenario": "Reject stale concurrent edits, invalid bindings and unauthorized publication.", "test_ref": null}, "integration": {"scenario": "Editor, store and compiler agree on the pinned revision after rollback.", "test_ref": null}}, "evidence": []
    },
    {
      "id": "standard.knowledge-bases", "description": "Governed term/member retrieval configuration, retrieval tests, synchronization and index lifecycle.", "category": "standard-domain",
      "observed_source": {"ref": "observed.standard", "confidence": "high"}, "state": "planned", "current_gap": "Synthetic member resolution is not an indexed knowledge lifecycle or general document chatbot.",
      "dependencies": ["standard.ontologies", "commercial.secret-references"], "owner_surface": "semantic-api", "issue": 35, "milestone": "M2",
      "acceptance": {"positive": {"scenario": "Resolve a scoped member with provenance after a completed index synchronization.", "test_ref": null}, "negative": {"scenario": "Ambiguous, stale or unauthorized retrieval cannot silently bind a member.", "test_ref": null}, "integration": {"scenario": "Ontology revision, search adapter and sync cancellation preserve the published index.", "test_ref": null}}, "evidence": []
    },
    {
      "id": "standard.resolvers", "description": "Versioned resolver discovery, validation, import preview and bounded sampling.", "category": "standard-domain",
      "observed_source": {"ref": "observed.standard", "confidence": "high"}, "state": "planned", "current_gap": "Fake and opt-in Databricks resolver subsets exist; the standard dynamic management workflow does not.",
      "dependencies": ["foundation.connector-conformance", "commercial.secret-references"], "owner_surface": "connectors", "issue": 37, "milestone": "M2",
      "acceptance": {"positive": {"scenario": "Discover and validate an adapter, preview metadata and sample within limits.", "test_ref": null}, "negative": {"scenario": "Unknown capabilities and unsafe identifiers fail closed without live calls.", "test_ref": null}, "integration": {"scenario": "Catalog registration, test workbench and runtime use the same pinned adapter.", "test_ref": null}}, "evidence": []
    },
    {
      "id": "standard.credentials", "description": "Manage secret references, lifecycle and delegated verification without disclosing values.", "category": "standard-domain",